{"entries":[],"generated_at":"1970-01-01T00:00:00Z","kind":"dashboard-package-inventory","schema_version":1,"source":{"build_evidence_count":0,"generated_at":null,"main_ref":null,"managed_metadata_count":0,"path":"catalog/package-index.json.gz","publication_evidence_count":0,"snapshot_id":null},"status_counts":{}}
